{
  "$schema": "https://json-schema.org/draft/2020-12/schema",
  "$id": "sciforge/schemas/REVIEW_STATE.schema.json",
  "title": "REVIEW_STATE.json - review loop round state + response_class",
  "description": "Produced by /auto-review-loop (State Persistence section: written at the end of every Phase E, overwritten each time). State fields per its SKILL.md plus the v5.1 anti-shrinkage response_class audit hook (artifact-registry.md: 'Round state + response_class'; auto-pipeline drift detection treats a missing response_class as constraint_field_missing).",
  "type": "object",
  "required": [
    "round",
    "threadId",
    "status",
    "difficulty",
    "last_score",
    "last_verdict",
    "pending_derivations",
    "timestamp",
    "response_class"
  ],
  "properties": {
    "round": {
      "type": "integer",
      "minimum": 1,
      "description": "Current round number."
    },
    "threadId": {
      "type": "string",
      "description": "Reviewer thread ID for round continuity."
    },
    "status": {
      "type": "string",
      "enum": ["in_progress", "completed"],
      "description": "completed is set at loop termination so future invocations do not resume a finished loop."
    },
    "difficulty": {
      "type": "string",
      "enum": ["medium", "hard", "nightmare"]
    },
    "last_score": {
      "type": "number",
      "minimum": 0,
      "maximum": 10,
      "description": "Most recent score (1-10 scale)."
    },
    "last_verdict": {
      "type": "string",
      "enum": ["ready", "almost", "not_ready", "not ready"],
      "description": "Most recent round verdict. Both 'not_ready' and 'not ready' spellings are accepted: the Phase A output format uses 'not ready' while the ledger field spec uses 'not_ready' (known gap, see schemas/README.md)."
    },
    "pending_derivations": {
      "type": "array",
      "description": "List of derivations still running.",
      "items": {
        "type": "string"
      }
    },
    "timestamp": {
      "type": "string",
      "pattern": "^[0-9]{4}-[0-9]{2}-[0-9]{2}T[0-9]{2}:[0-9]{2}:[0-9]{2}(\\.[0-9]+)?(Z|[+-][0-9]{2}:[0-9]{2})?$",
      "description": "ISO-8601; state older than 24h with status in_progress is treated as stale (fresh start)."
    },
    "response_class": {
      "type": "array",
      "description": "Per-concern substantive-response classification (anti-shrinkage protocol). May be an empty array when the round has no reviewer concerns yet, but the field itself must exist. wording-only rounds are invalid (round_invalid: true).",
      "items": {
        "type": "object",
        "required": ["response_class"],
        "properties": {
          "concern": {
            "type": "string",
            "description": "The reviewer concern this response addresses."
          },
          "response_class": {
            "type": "string",
            "enum": ["experiment_redesign", "pivot", "kill", "wording"]
          }
        },
        "additionalProperties": true
      }
    },
    "round_invalid": {
      "type": "boolean",
      "description": "True when the round's fix list was wording-only (round does not consume MAX_ROUNDS budget and must be redone)."
    }
  },
  "additionalProperties": true
}
